[
  {
    "first_name": "James",
    "middle_names": null,
    "last_name": "Frame",
    "gender": "Male",
    "birth_date": "1848-09-24",
    "birth_place": "Lanark, South Lanarkshire, Scotland",
    "death_date": "1906-01-25",
    "death_place": "Kookynie, Menzies Shire, Western Australia",
    "age_at_death": "57 years",
    "burial_place": "Kookynie Cemetery"
  }
]