[
  {
    "first_name": "Bridget",
    "middle_names": null,
    "last_name": "Baker",
    "gender": "Female",
    "birth_date": "1855-01-01",
    "birth_place": null,
    "death_date": null,
    "death_place": null,
    "age_at_death": null,
    "burial_place": null
  },
  {
    "first_name": "John",
    "middle_names": null,
    "last_name": "Green/e",
    "gender": "Male",
    "birth_date": "1845-01-01",
    "birth_place": null,
    "death_date": "1909-01-01",
    "death_place": null,
    "age_at_death": "64 years",
    "burial_place": null
  },
  {
    "first_name": "Cecelia",
    "middle_names": null,
    "last_name": "Green",
    "gender": "Female",
    "birth_date": "1878-01-01",
    "birth_place": null,
    "death_date": null,
    "death_place": null,
    "age_at_death": null,
    "burial_place": null
  },
  {
    "first_name": "Thomas",
    "middle_names": null,
    "last_name": "Green",
    "gender": "Male",
    "birth_date": "1880-01-01",
    "birth_place": null,
    "death_date": "1909-01-01",
    "death_place": null,
    "age_at_death": "29 years",
    "burial_place": null
  },
  {
    "first_name": "Mary Teresa",
    "middle_names": null,
    "last_name": "Green",
    "gender": "Female",
    "birth_date": "1880-01-01",
    "birth_place": null,
    "death_date": "1942-01-01",
    "death_place": null,
    "age_at_death": "62 years",
    "burial_place": null
  },
  {
    "first_name": "Harrold James",
    "middle_names": null,
    "last_name": "Keightley",
    "gender": "Male",
    "birth_date": "1879-01-01",
    "birth_place": null,
    "death_date": "1943-01-01",
    "death_place": null,
    "age_at_death": "64 years",
    "burial_place": null
  },
  {
    "first_name": "Maude Wilson",
    "middle_names": null,
    "last_name": "Keightley",
    "gender": "Female",
    "birth_date": "1907-01-01",
    "birth_place": null,
    "death_date": "1988-01-01",
    "death_place": null,
    "age_at_death": "81 years",
    "burial_place": null
  },
  {
    "first_name": "Leonard Charles",
    "middle_names": null,
    "last_name": "Kimber",
    "gender": "Male",
    "birth_date": "1909-01-01",
    "birth_place": null,
    "death_date": "1975-01-01",
    "death_place": null,
    "age_at_death": "66 years",
    "burial_place": null
  },
  {
    "first_name": "Samuel Clifford",
    "middle_names": null,
    "last_name": "Keightley",
    "gender": "Male",
    "birth_date": "1908-01-01",
    "birth_place": null,
    "death_date": "1981-01-01",
    "death_place": null,
    "age_at_death": "73 years",
    "burial_place": null
  },
  {
    "first_name": "Marjorie Ada",
    "middle_names": null,
    "last_name": "Bradshaw",
    "gender": "Female",
    "birth_date": "1910-01-01",
    "birth_place": null,
    "death_date": null,
    "death_place": null,
    "age_at_death": null,
    "burial_place": null
  },
  {
    "first_name": "Thomas",
    "middle_names": "Reg Reginald",
    "last_name": "Keightley",
    "gender": "Male",
    "birth_date": "1909-01-01",
    "birth_place": null,
    "death_date": "1987-01-01",
    "death_place": null,
    "age_at_death": "78 years",
    "burial_place": null
  },
  {
    "first_name": "Dorothy Caroline",
    "middle_names": null,
    "last_name": "Banks",
    "gender": "Female",
    "birth_date": "1911-01-01",
    "birth_place": null,
    "death_date": "1990-01-01",
    "death_place": null,
    "age_at_death": "79 years",
    "burial_place": null
  },
  {
    "first_name": "Un-named",
    "middle_names": null,
    "last_name": "Green",
    "gender": null,
    "birth_date": "1883-01-01",
    "birth_place": null,
    "death_date": "1909-01-01",
    "death_place": null,
    "age_at_death": "26 years",
    "burial_place": null
  },
  {
    "first_name": "Elizabeth",
    "middle_names": null,
    "last_name": "Green",
    "gender": "Female",
    "birth_date": "1886-01-01",
    "birth_place": null,
    "death_date": "1909-01-01",
    "death_place": null,
    "age_at_death": "23 years",
    "burial_place": null
  },
  {
    "first_name": "Martin Francis",
    "middle_names": null,
    "last_name": "Green",
    "gender": "Male",
    "birth_date": "1888-01-01",
    "birth_place": null,
    "death_date": "1918-01-01",
    "death_place": null,
    "age_at_death": "30 years",
    "burial_place": null
  },
  {
    "first_name": "Annie",
    "middle_names": null,
    "last_name": "Green",
    "gender": "Female",
    "birth_date": "1890-01-01",
    "birth_place": null,
    "death_date": "1891-01-01",
    "death_place": null,
    "age_at_death": "1 year",
    "burial_place": null
  }
]